{
  "meta": {
    "schemaVersion": "2.0",
    "packageId": "ingestion-package-2026-06-14-foundation",
    "createdAt": "2026-06-14T12:00:00Z",
    "language": "es",
    "domains": [
      "technology",
      "ai",
      "economy"
    ]
  },
  "run": {
    "runId": "run-2026-06-14-foundation",
    "runDate": "2026-06-14",
    "status": "complete",
    "candidateCount": 15,
    "selectedCount": 6,
    "rejectedCount": 2,
    "watchItemCount": 2,
    "sourceDiversity": {
      "domainCounts": {
        "technology": 5,
        "ai": 6,
        "economy": 4
      },
      "publisherCounts": {
        "OpenAI": 3,
        "NVIDIA": 3,
        "Federal Reserve": 3,
        "European Commission": 3,
        "The Information": 3
      },
      "concentrationRisk": "low",
      "concentrationRationale": "Foundation sample is intentionally balanced across the three target domains.",
      "alternativeSearchNotes": "Story-specific discovery notes are added as the candidate pool becomes realistic.",
      "narrativeCounts": {
        "ai workflow moats": 4,
        "infrastructure constraints": 3,
        "macro regulation trust": 3
      }
    }
  },
  "readerProfiles": [
    {
      "profileId": "sergio-canonical",
      "displayName": "Sergio Ramirez",
      "canonical": true,
      "roles": [
        "operator",
        "editor",
        "learner"
      ],
      "interests": [
        "technology",
        "ai",
        "economy"
      ],
      "advantageTargets": [
        "labor-market edge",
        "strategic judgment"
      ]
    }
  ],
  "sources": [
    {
      "sourceId": "src-01",
      "title": "Evidence for AI labs shift from model demos to enterprise workflow agents",
      "publisher": "SEC filing",
      "sourceType": "filing",
      "sourceRole": "primary",
      "url": "https://example.com/evidence/sig-01",
      "publishedAt": "2026-06-14T09:00:00Z",
      "credibilityNotes": "Sample provenance record: replace with the actual source URL, timestamp, and access notes during a real run."
    },
    {
      "sourceId": "src-02",
      "title": "Evidence for Chip supply constraints keep inference economics strategically important",
      "publisher": "Central bank",
      "sourceType": "speech",
      "sourceRole": "market_context",
      "url": "https://example.com/evidence/sig-02",
      "publishedAt": "2026-06-14T09:00:00Z",
      "credibilityNotes": "Sample provenance record: replace with the actual source URL, timestamp, and access notes during a real run."
    },
    {
      "sourceId": "src-03",
      "title": "Evidence for Central bank language keeps rate-cut timing conditional on inflation data",
      "publisher": "Policy body",
      "sourceType": "guidance",
      "sourceRole": "source_of_record",
      "url": "https://example.com/evidence/sig-03",
      "publishedAt": "2026-06-14T09:00:00Z",
      "credibilityNotes": "Sample provenance record: replace with the actual source URL, timestamp, and access notes during a real run."
    },
    {
      "sourceId": "src-04",
      "title": "Evidence for Open model releases pressure closed-model differentiation",
      "publisher": "Industry analysis",
      "sourceType": "expert_analysis",
      "sourceRole": "technical_analysis",
      "url": "https://example.com/evidence/sig-04",
      "publishedAt": "2026-06-14T09:00:00Z",
      "credibilityNotes": "Sample provenance record: replace with the actual source URL, timestamp, and access notes during a real run."
    },
    {
      "sourceId": "src-05",
      "title": "Evidence for Cloud platforms package AI services into higher-level developer primitives",
      "publisher": "Company blog",
      "sourceType": "official_blog",
      "sourceRole": "economic_analysis",
      "url": "https://example.com/evidence/sig-05",
      "publishedAt": "2026-06-14T09:00:00Z",
      "credibilityNotes": "Sample provenance record: replace with the actual source URL, timestamp, and access notes during a real run."
    },
    {
      "sourceId": "src-06",
      "title": "Evidence for Regulators focus on AI transparency in high-impact domains",
      "publisher": "SEC filing",
      "sourceType": "filing",
      "sourceRole": "regulatory_context",
      "url": "https://example.com/evidence/sig-06",
      "publishedAt": "2026-06-14T09:00:00Z",
      "credibilityNotes": "Sample provenance record: replace with the actual source URL, timestamp, and access notes during a real run."
    },
    {
      "sourceId": "src-07",
      "title": "Evidence for Enterprise software vendors reprice seats around embedded AI features",
      "publisher": "Central bank",
      "sourceType": "speech",
      "sourceRole": "market_context",
      "url": "https://example.com/evidence/sig-07",
      "publishedAt": "2026-06-14T09:00:00Z",
      "credibilityNotes": "Sample provenance record: replace with the actual source URL, timestamp, and access notes during a real run."
    },
    {
      "sourceId": "src-08",
      "title": "Evidence for Data-center power demand reframes AI infrastructure as an energy bottleneck",
      "publisher": "Policy body",
      "sourceType": "guidance",
      "sourceRole": "critical_contrast",
      "url": "https://example.com/evidence/sig-08",
      "publishedAt": "2026-06-14T09:00:00Z",
      "credibilityNotes": "Sample provenance record: replace with the actual source URL, timestamp, and access notes during a real run."
    },
    {
      "sourceId": "src-09",
      "title": "Evidence for Autonomous coding tools move from autocomplete to repository-level changes",
      "publisher": "Industry analysis",
      "sourceType": "expert_analysis",
      "sourceRole": "technical_analysis",
      "url": "https://example.com/evidence/sig-09",
      "publishedAt": "2026-06-14T09:00:00Z",
      "credibilityNotes": "Sample provenance record: replace with the actual source URL, timestamp, and access notes during a real run."
    },
    {
      "sourceId": "src-10",
      "title": "Evidence for Public-market investors scrutinize AI capex payback periods",
      "publisher": "Company blog",
      "sourceType": "official_blog",
      "sourceRole": "economic_analysis",
      "url": "https://example.com/evidence/sig-10",
      "publishedAt": "2026-06-14T09:00:00Z",
      "credibilityNotes": "Sample provenance record: replace with the actual source URL, timestamp, and access notes during a real run."
    },
    {
      "sourceId": "src-11",
      "title": "Evidence for Browser and device vendors compete to make AI the default interface layer",
      "publisher": "SEC filing",
      "sourceType": "filing",
      "sourceRole": "secondary_coverage",
      "url": "https://example.com/evidence/sig-11",
      "publishedAt": "2026-06-14T09:00:00Z",
      "credibilityNotes": "Sample provenance record: replace with the actual source URL, timestamp, and access notes during a real run."
    },
    {
      "sourceId": "src-12",
      "title": "Evidence for Synthetic media tools force new provenance and trust workflows",
      "publisher": "Central bank",
      "sourceType": "speech",
      "sourceRole": "critical_contrast",
      "url": "https://example.com/evidence/sig-12",
      "publishedAt": "2026-06-14T09:00:00Z",
      "credibilityNotes": "Sample provenance record: replace with the actual source URL, timestamp, and access notes during a real run."
    },
    {
      "sourceId": "src-13",
      "title": "Evidence for Labor-market data shows uneven white-collar hiring amid automation narratives",
      "publisher": "Policy body",
      "sourceType": "guidance",
      "sourceRole": "source_of_record",
      "url": "https://example.com/evidence/sig-13",
      "publishedAt": "2026-06-14T09:00:00Z",
      "credibilityNotes": "Sample provenance record: replace with the actual source URL, timestamp, and access notes during a real run."
    },
    {
      "sourceId": "src-14",
      "title": "Evidence for Database vendors add vector and retrieval features to defend application workloads",
      "publisher": "Industry analysis",
      "sourceType": "expert_analysis",
      "sourceRole": "technical_analysis",
      "url": "https://example.com/evidence/sig-14",
      "publishedAt": "2026-06-14T09:00:00Z",
      "credibilityNotes": "Sample provenance record: replace with the actual source URL, timestamp, and access notes during a real run."
    },
    {
      "sourceId": "src-15",
      "title": "Evidence for AI safety evaluations become procurement criteria for large buyers",
      "publisher": "Company blog",
      "sourceType": "official_blog",
      "sourceRole": "regulatory_context",
      "url": "https://example.com/evidence/sig-15",
      "publishedAt": "2026-06-14T09:00:00Z",
      "credibilityNotes": "Sample provenance record: replace with the actual source URL, timestamp, and access notes during a real run."
    }
  ],
  "candidates": [
    {
      "signalId": "sig-01",
      "title": "AI labs shift from model demos to enterprise workflow agents",
      "factualSummary": "A leading AI vendor framed its latest product update around task orchestration, tool use, and enterprise controls rather than raw benchmark gains.",
      "domainTags": [
        "ai"
      ],
      "sourceIds": [
        "src-01"
      ],
      "status": "selected",
      "editorialRationale": "Tests whether agentic AI monetizes through workflow ownership instead of model novelty.",
      "educationalValue": {
        "score": 0.88,
        "teachingMechanisms": [
          "causal_mechanism",
          "reusable_mental_model"
        ],
        "learningRationale": "This item teaches causal mechanism through a concrete market signal.",
        "deepDivePotential": "strong"
      },
      "profileRelevance": [
        {
          "profileId": "sergio-canonical",
          "relevanceRationale": "Alta relevancia para Sergio porque convierte una señal de mercado en una tesis reutilizable sobre IA, tecnología y economía.",
          "relevanceScore": 0.82
        }
      ],